{"schema":"riffdb-reactive-ticketdesk-run/v1","run_id":"wp421-reactive-codex-04","bundle_hash":"2a62f87b06c6bd3448ada75a196a95fd79a9bf4c6c0a0a8071c400d85f047320","agent_identity":"codex-wp421-reactive-04","independent":true,"fresh_context":true,"human_interventions":0,"kernel_attempts":0,"kernel_successes":0,"handwritten_glue_lines":0,"compiler_failures":0,"runtime_failures":7,"time_to_complete_seconds":305,"source_access":{"riffdb_implementation":false,"ticketdesk_implementation":false},"checks":{"application_boundary":true,"browser_credentials_absent":false,"browser_two_session_convergence":false,"commit_before_ack_recovery":false,"contextual_one_snapshot":false,"generated_bindings_exact":true,"mcp_wakeup_payload_free":false,"reaction_retry_idempotent":false,"reconnect_reset":false,"revocation_clears_state":false},"completed":false,"rating":2,"explanation":"The supplied Source V4 compiled cleanly to exact Lock V5 and exact Rust, TypeScript, Python, and MCP artifacts, and the bundled application boundary checker passed. Exact application deployment succeeded, but every documented exact role-binding path failed closed with RDB-AR004 reporting a stale application-role query-module identity despite the deployed exact package. The bundled TypeScript runtime also lacks the contextual transport methods required by the generated TriageTicket client. No grant was constructed, no kernel path was attempted, and no internal source was accessed. Without an authorized generated application and agent runtime, the browser convergence, reconnect, authorization termination, contextual hydration, reaction recovery, idempotency, and MCP wakeup requirements could not be exercised and are reported false.","transcript_sha256":"5c0454daad4d48d004d548665ee5684a7b2b1d881b0a93ac88fd3dd7017015a7"}
